{
  "schemaVersion": "lfe.evidence/0.1",
  "id": "EVID-001",
  "testId": "TEST-001",
  "requirementIds": [],
  "argv": [
    "python3",
    "-m",
    "unittest",
    "discover",
    "-s",
    "tests"
  ],
  "cwd": ".",
  "environment": {
    "os": "Darwin",
    "osRelease": "25.6.0",
    "python": "3.11.5",
    "tools": {}
  },
  "sourceRevision": {
    "git": "16414d6",
    "dirty": false
  },
  "startedAt": "2026-10-19T09:00:00Z",
  "durationMs": 31,
  "exitCode": 0,
  "testsRun": 13,
  "testsSkipped": 0,
  "status": "pass",
  "artifacts": [
    {
      "path": ".lfe/evidence/EVID-001/stdout.txt",
      "sha256": "sha256:63d42d26156fcc761e57da4128e9881d5bdf3bf933f0f6e9c93d6e26b9b90ae7"
    }
  ],
  "limitations": [
    "ambiente local; não representa produção"
  ],
  "producer": "lfe-run/0.1"
}
